{
  "sample_id": "manual_003_keepass_password_safe",
  "metadata": {
    "domain": "password_management",
    "source_type": "manual",
    "parent_id": null,
    "split": "test",
    "dialogue_style": "noisy"
  },
  "source": {
    "dataset": "pure",
    "dataset_doi": "10.5281/zenodo.7118517",
    "record_url": "https://zenodo.org/records/7118517",
    "document_id": "2008_keepass",
    "source_sentence_ids": [
      "1.4",
      "2.2",
      "2.5",
      "3.1",
      "3.2",
      "3.5",
      "3.10",
      "3.18",
      "5.1",
      "5.2"
    ]
  },
  "dialogue": [
    {
      "turn_id": 1,
      "role": "bot",
      "text": "What kind of system do you want?"
    },
    {
      "turn_id": 2,
      "role": "user",
      "text": "A password safe app for storing account credentials in one place."
    },
    {
      "turn_id": 3,
      "role": "bot",
      "text": "Who will use it?"
    },
    {
      "turn_id": 4,
      "role": "user",
      "text": "Mostly end users, but system administrators too."
    },
    {
      "turn_id": 5,
      "role": "bot",
      "text": "What should users be able to do?"
    },
    {
      "turn_id": 6,
      "role": "user",
      "text": "They should create and open encrypted databases, search stored entries, add or edit entries, and import or export password data."
    },
    {
      "turn_id": 7,
      "role": "bot",
      "text": "Do users need login or authentication?"
    },
    {
      "turn_id": 8,
      "role": "user",
      "text": "Yes. Unlocking should use a master password, and maybe a key file too if they want a composite key."
    },
    {
      "turn_id": 9,
      "role": "bot",
      "text": "Are there performance requirements?"
    },
    {
      "turn_id": 10,
      "role": "user",
      "text": "If somebody copies a password, keep it in memory for only 10 seconds."
    },
    {
      "turn_id": 11,
      "role": "bot",
      "text": "Are there security requirements?"
    },
    {
      "turn_id": 12,
      "role": "user",
      "text": "The database has to stay encrypted, it must refuse to open without the required master password or key file, and there cannot be any recovery password or backdoor."
    }
  ],
  "slots": {
    "system_type": {
      "value": "password safe application",
      "evidence_turns": [
        2
      ]
    },
    "user_roles": [
      {
        "value": "end users",
        "evidence_turns": [
          4
        ]
      },
      {
        "value": "system administrators",
        "evidence_turns": [
          4
        ]
      }
    ],
    "functional_capabilities": [
      {
        "actor": "end users",
        "action": "create and open encrypted password databases",
        "evidence_turns": [
          6
        ]
      },
      {
        "actor": "end users",
        "action": "search stored entries",
        "evidence_turns": [
          6
        ]
      },
      {
        "actor": "end users",
        "action": "add and edit entries",
        "evidence_turns": [
          6
        ]
      },
      {
        "actor": "end users",
        "action": "import and export password data",
        "evidence_turns": [
          6
        ]
      }
    ],
    "authentication": {
      "required": true,
      "methods": [
        "master password",
        "key file",
        "composite master key"
      ],
      "evidence_turns": [
        8
      ]
    },
    "performance_constraints": [
      {
        "text": "keep copied passwords in memory for no more than 10 seconds",
        "evidence_turns": [
          10
        ]
      }
    ],
    "security_constraints": [
      {
        "text": "store passwords in an encrypted database",
        "evidence_turns": [
          12
        ]
      },
      {
        "text": "refuse to open a database without the required master password or key file",
        "evidence_turns": [
          12
        ]
      },
      {
        "text": "provide no recovery password or backdoor for unlocking databases",
        "evidence_turns": [
          12
        ]
      }
    ]
  },
  "requirements": {
    "functional": [
      {
        "id": "FR1",
        "text": "The system shall support authentication using master password, key file, and composite master key.",
        "source_slots": [
          "authentication"
        ]
      },
      {
        "id": "FR2",
        "text": "The system shall allow end users to create and open encrypted password databases.",
        "source_slots": [
          "functional_capabilities[0]"
        ]
      },
      {
        "id": "FR3",
        "text": "The system shall allow end users to search stored entries.",
        "source_slots": [
          "functional_capabilities[1]"
        ]
      },
      {
        "id": "FR4",
        "text": "The system shall allow end users to add and edit entries.",
        "source_slots": [
          "functional_capabilities[2]"
        ]
      },
      {
        "id": "FR5",
        "text": "The system shall allow end users to import and export password data.",
        "source_slots": [
          "functional_capabilities[3]"
        ]
      }
    ],
    "non_functional": [
      {
        "id": "NFR1",
        "category": "performance",
        "text": "The system shall keep copied passwords in memory for no more than 10 seconds.",
        "source_slots": [
          "performance_constraints[0]"
        ]
      },
      {
        "id": "NFR2",
        "category": "security",
        "text": "The system shall store passwords in an encrypted database.",
        "source_slots": [
          "security_constraints[0]"
        ]
      },
      {
        "id": "NFR3",
        "category": "security",
        "text": "The system shall refuse to open a database without the required master password or key file.",
        "source_slots": [
          "security_constraints[1]"
        ]
      },
      {
        "id": "NFR4",
        "category": "security",
        "text": "The system shall provide no recovery password or backdoor for unlocking databases.",
        "source_slots": [
          "security_constraints[2]"
        ]
      }
    ]
  },
  "frames": [
    {
      "frame_id": "F1",
      "kind": "system_context",
      "actor": null,
      "action": "system_type",
      "object": "password safe application",
      "constraint": null,
      "channel": null,
      "evidence_turns": [
        2
      ],
      "status": "confirmed"
    },
    {
      "frame_id": "F2",
      "kind": "user_role",
      "actor": "end users",
      "action": "user_role",
      "object": null,
      "constraint": null,
      "channel": null,
      "evidence_turns": [
        4
      ],
      "status": "confirmed"
    },
    {
      "frame_id": "F3",
      "kind": "user_role",
      "actor": "system administrators",
      "action": "user_role",
      "object": null,
      "constraint": null,
      "channel": null,
      "evidence_turns": [
        4
      ],
      "status": "confirmed"
    },
    {
      "frame_id": "F4",
      "kind": "functional_capability",
      "actor": "end users",
      "action": "create and open encrypted password databases",
      "object": null,
      "constraint": null,
      "channel": null,
      "evidence_turns": [
        6
      ],
      "status": "confirmed"
    },
    {
      "frame_id": "F5",
      "kind": "functional_capability",
      "actor": "end users",
      "action": "search stored entries",
      "object": null,
      "constraint": null,
      "channel": null,
      "evidence_turns": [
        6
      ],
      "status": "confirmed"
    },
    {
      "frame_id": "F6",
      "kind": "functional_capability",
      "actor": "end users",
      "action": "add and edit entries",
      "object": null,
      "constraint": null,
      "channel": null,
      "evidence_turns": [
        6
      ],
      "status": "confirmed"
    },
    {
      "frame_id": "F7",
      "kind": "functional_capability",
      "actor": "end users",
      "action": "import and export password data",
      "object": null,
      "constraint": null,
      "channel": null,
      "evidence_turns": [
        6
      ],
      "status": "confirmed"
    },
    {
      "frame_id": "F8",
      "kind": "authentication",
      "actor": null,
      "action": "authenticate",
      "object": "master password",
      "constraint": "required",
      "channel": null,
      "evidence_turns": [
        8
      ],
      "status": "confirmed"
    },
    {
      "frame_id": "F9",
      "kind": "authentication",
      "actor": null,
      "action": "authenticate",
      "object": "key file",
      "constraint": "required",
      "channel": null,
      "evidence_turns": [
        8
      ],
      "status": "confirmed"
    },
    {
      "frame_id": "F10",
      "kind": "authentication",
      "actor": null,
      "action": "authenticate",
      "object": "composite master key",
      "constraint": "required",
      "channel": null,
      "evidence_turns": [
        8
      ],
      "status": "confirmed"
    },
    {
      "frame_id": "F11",
      "kind": "performance",
      "actor": null,
      "action": null,
      "object": null,
      "constraint": "keep copied passwords in memory for no more than 10 seconds",
      "channel": null,
      "evidence_turns": [
        10
      ],
      "status": "confirmed"
    },
    {
      "frame_id": "F12",
      "kind": "security",
      "actor": null,
      "action": null,
      "object": null,
      "constraint": "store passwords in an encrypted database",
      "channel": null,
      "evidence_turns": [
        12
      ],
      "status": "confirmed"
    },
    {
      "frame_id": "F13",
      "kind": "security",
      "actor": null,
      "action": null,
      "object": null,
      "constraint": "refuse to open a database without the required master password or key file",
      "channel": null,
      "evidence_turns": [
        12
      ],
      "status": "confirmed"
    },
    {
      "frame_id": "F14",
      "kind": "security",